{
  "$schema": "https://json-schema.org/draft/2020-12/schema",
  "$id": "https://harnessos.local/schemas/v9_3_station_agent_binding.schema.json",
  "title": "V9-3 StationAgentBinding",
  "type": "object",
  "required": [
    "schema_version",
    "binding_id",
    "orchestration_run_id",
    "station_id",
    "agent_id",
    "policy_ref",
    "credential_decision_ref",
    "correlation_id",
    "request_id",
    "audit_ref",
    "created_at"
  ],
  "properties": {
    "schema_version": { "const": "v9_3.station_agent_binding.v1" },
    "binding_id": { "type": "string", "minLength": 1 },
    "orchestration_run_id": { "type": "string", "minLength": 1 },
    "station_id": { "type": "string", "minLength": 1 },
    "agent_id": { "type": "string", "minLength": 1 },
    "policy_ref": { "type": "string", "minLength": 1 },
    "credential_decision_ref": { "type": "string", "minLength": 1 },
    "correlation_id": { "type": "string", "minLength": 1 },
    "request_id": { "type": "string", "minLength": 1 },
    "audit_ref": { "type": "string", "minLength": 1 },
    "created_at": { "type": "string", "format": "date-time" }
  },
  "additionalProperties": false
}
